{
  "schema_version": "1",
  "verification_id": "ve_20260911T214156054379Z_dev_test_policy",
  "asset_id": "dev_test_policy",
  "verified_at": "2026-09-11T21:41:56.055380+00:00",
  "verified_revision": "763f8c8e865130c165198696de4d2ab957d9ddfd",
  "verification_method": "phase2a2_baseline_enrollment",
  "resolved_watch_paths": [
    "docs/DEVELOPMENT_TEST_POLICY.md",
    "ai_tool/policy/development_policy.json"
  ],
  "watch_snapshots": [
    {
      "path": "docs/DEVELOPMENT_TEST_POLICY.md",
      "existence": true,
      "content_fingerprint": "sha256:6b4aca8f8744ce74e11284a0bc25b6c7005567632bf1064ef5a50358e532c417",
      "git_state_if_available": {
        "path": "docs/DEVELOPMENT_TEST_POLICY.md",
        "tracked": true,
        "porcelain": null
      }
    },
    {
      "path": "ai_tool/policy/development_policy.json",
      "existence": true,
      "content_fingerprint": "sha256:34c9ac87159846d5a41afe87566e8e71c42542eaf3daad3408df043ce28b2e1d",
      "git_state_if_available": {
        "path": "ai_tool/policy/development_policy.json",
        "tracked": true,
        "porcelain": null
      }
    }
  ],
  "source_audit": {
    "verification_method": "cursor_development_governance_audit_read_only",
    "verified_at": "2026-09-11T21:19:00+09:00",
    "verified_revision": "763f8c8e865130c165198696de4d2ab957d9ddfd",
    "label": "cursor_development_governance_audit_read_only"
  },
  "enrollment_phase": "2A.2"
}
