{
  "schema_version": "1",
  "verification_id": "ve_20260911T214155825674Z_concept_definitions",
  "asset_id": "concept_definitions",
  "verified_at": "2026-09-11T21:41:55.826674+00:00",
  "verified_revision": "763f8c8e865130c165198696de4d2ab957d9ddfd",
  "verification_method": "phase2a2_baseline_enrollment",
  "resolved_watch_paths": [
    "docs/concepts/CONCEPT_DEFINITIONS.md",
    "ai_tool/policy/development_policy.json"
  ],
  "watch_snapshots": [
    {
      "path": "docs/concepts/CONCEPT_DEFINITIONS.md",
      "existence": true,
      "content_fingerprint": "sha256:adb54304c529e5611d3198e5bbd563c4f4e384788e6f3153bdff935ec53624d2",
      "git_state_if_available": {
        "path": "docs/concepts/CONCEPT_DEFINITIONS.md",
        "tracked": true,
        "porcelain": null
      }
    },
    {
      "path": "ai_tool/policy/development_policy.json",
      "existence": true,
      "content_fingerprint": "sha256:34c9ac87159846d5a41afe87566e8e71c42542eaf3daad3408df043ce28b2e1d",
      "git_state_if_available": {
        "path": "ai_tool/policy/development_policy.json",
        "tracked": true,
        "porcelain": null
      }
    }
  ],
  "source_audit": {
    "verification_method": "cursor_development_governance_audit_read_only",
    "verified_at": "2026-09-11T21:19:00+09:00",
    "verified_revision": "763f8c8e865130c165198696de4d2ab957d9ddfd",
    "label": "cursor_development_governance_audit_read_only"
  },
  "enrollment_phase": "2A.2"
}
