{
  "schema_version": "1",
  "verification_id": "ve_20260911T214157440093Z_models_registry",
  "asset_id": "models_registry",
  "verified_at": "2026-09-11T21:41:57.440093+00:00",
  "verified_revision": "763f8c8e865130c165198696de4d2ab957d9ddfd",
  "verification_method": "phase2a2_baseline_enrollment",
  "resolved_watch_paths": [
    "registry/models.json"
  ],
  "watch_snapshots": [
    {
      "path": "registry/models.json",
      "existence": true,
      "content_fingerprint": "sha256:b1e5e42402182999a6df54f88b4d29e6de3059f41051402ff5eb75fcf4508643",
      "git_state_if_available": {
        "path": "registry/models.json",
        "tracked": true,
        "porcelain": null
      }
    }
  ],
  "source_audit": {
    "verification_method": "cursor_development_governance_audit_read_only",
    "verified_at": "2026-09-11T21:19:00+09:00",
    "verified_revision": "763f8c8e865130c165198696de4d2ab957d9ddfd",
    "label": "cursor_development_governance_audit_read_only"
  },
  "enrollment_phase": "2A.2"
}
