{
  "schema_version": "1",
  "verification_id": "ve_20260911T214159652884Z_skills_registry",
  "asset_id": "skills_registry",
  "verified_at": "2026-09-11T21:41:59.652884+00:00",
  "verified_revision": "763f8c8e865130c165198696de4d2ab957d9ddfd",
  "verification_method": "phase2a2_baseline_enrollment",
  "resolved_watch_paths": [
    "registry/skills.json",
    "tests/registry/test_skills_registry.py",
    "registry/schema/skills.schema.json"
  ],
  "watch_snapshots": [
    {
      "path": "registry/skills.json",
      "existence": true,
      "content_fingerprint": "sha256:e083dda0d86e818095679eb71685d7d9dc3c06a1ccd066b428671363c3e4e320",
      "git_state_if_available": {
        "path": "registry/skills.json",
        "tracked": true,
        "porcelain": null
      }
    },
    {
      "path": "tests/registry/test_skills_registry.py",
      "existence": true,
      "content_fingerprint": "sha256:59747041b62c0b9e5025ec456182b68d34fc77b501cca5cd5d4aff62ae0de260",
      "git_state_if_available": {
        "path": "tests/registry/test_skills_registry.py",
        "tracked": true,
        "porcelain": null
      }
    },
    {
      "path": "registry/schema/skills.schema.json",
      "existence": true,
      "content_fingerprint": "sha256:daf67c459b0474b4557c02608269e865cb424eee6cb44d93f21fcd90bfb77b28",
      "git_state_if_available": {
        "path": "registry/schema/skills.schema.json",
        "tracked": true,
        "porcelain": null
      }
    }
  ],
  "source_audit": {
    "verification_method": "cursor_development_governance_audit_read_only",
    "verified_at": "2026-09-11T21:19:00+09:00",
    "verified_revision": "763f8c8e865130c165198696de4d2ab957d9ddfd",
    "label": "cursor_development_governance_audit_read_only"
  },
  "enrollment_phase": "2A.2"
}
