{
  "schema_version": "1",
  "verification_id": "ve_20260911T214157079343Z_goal_handoff_spec",
  "asset_id": "goal_handoff_spec",
  "verified_at": "2026-09-11T21:41:57.080345+00:00",
  "verified_revision": "763f8c8e865130c165198696de4d2ab957d9ddfd",
  "verification_method": "phase2a2_baseline_enrollment",
  "resolved_watch_paths": [
    "docs/specs/GOAL_HANDOFF_V0.md",
    "tests/registry/test_skills_registry.py"
  ],
  "watch_snapshots": [
    {
      "path": "docs/specs/GOAL_HANDOFF_V0.md",
      "existence": true,
      "content_fingerprint": "sha256:fdbfd34588ef5a84de4affe85920cdce8f3d8605a5802e13712422f0c06ee4b9",
      "git_state_if_available": {
        "path": "docs/specs/GOAL_HANDOFF_V0.md",
        "tracked": true,
        "porcelain": null
      }
    },
    {
      "path": "tests/registry/test_skills_registry.py",
      "existence": true,
      "content_fingerprint": "sha256:59747041b62c0b9e5025ec456182b68d34fc77b501cca5cd5d4aff62ae0de260",
      "git_state_if_available": {
        "path": "tests/registry/test_skills_registry.py",
        "tracked": true,
        "porcelain": null
      }
    }
  ],
  "source_audit": {
    "verification_method": "cursor_development_governance_audit_read_only",
    "verified_at": "2026-09-11T21:19:00+09:00",
    "verified_revision": "763f8c8e865130c165198696de4d2ab957d9ddfd",
    "label": "cursor_development_governance_audit_read_only"
  },
  "enrollment_phase": "2A.2"
}
