{
  "schema_version": "1",
  "verification_id": "ve_20260911T214200573507Z_task_execution_guard",
  "asset_id": "task_execution_guard",
  "verified_at": "2026-09-11T21:42:00.574508+00:00",
  "verified_revision": "763f8c8e865130c165198696de4d2ab957d9ddfd",
  "verification_method": "phase2a2_baseline_enrollment",
  "resolved_watch_paths": [
    "ai_tool/task_execution_guard.py"
  ],
  "watch_snapshots": [
    {
      "path": "ai_tool/task_execution_guard.py",
      "existence": true,
      "content_fingerprint": "sha256:71658db15b80a649acd703e3fb9fca1e2e8c68203fc6009cf3036c7803ec84ea",
      "git_state_if_available": {
        "path": "ai_tool/task_execution_guard.py",
        "tracked": true,
        "porcelain": null
      }
    }
  ],
  "source_audit": {
    "verification_method": "cursor_development_governance_audit_read_only",
    "verified_at": "2026-09-11T21:19:00+09:00",
    "verified_revision": "763f8c8e865130c165198696de4d2ab957d9ddfd",
    "label": "cursor_development_governance_audit_read_only"
  },
  "enrollment_phase": "2A.2"
}
