{
  "schema_version": "1",
  "verification_id": "ve_20260911T214247749177Z_project_spec",
  "asset_id": "project_spec",
  "verified_at": "2026-09-11T21:42:47.750175+00:00",
  "verified_revision": "763f8c8e865130c165198696de4d2ab957d9ddfd",
  "verification_method": "phase2a2_baseline_enrollment",
  "resolved_watch_paths": [
    "PROJECT_SPEC.md"
  ],
  "watch_snapshots": [
    {
      "path": "PROJECT_SPEC.md",
      "existence": true,
      "content_fingerprint": "sha256:4c89fefa1955ef54fa9c1793b488486d587083225f23dadbe55289cf80fe252f",
      "git_state_if_available": {
        "path": "PROJECT_SPEC.md",
        "tracked": true,
        "porcelain": null
      }
    }
  ],
  "source_audit": {
    "verification_method": "cursor_development_governance_audit_read_only",
    "verified_at": "2026-09-11T21:19:00+09:00",
    "verified_revision": "763f8c8e865130c165198696de4d2ab957d9ddfd",
    "label": "cursor_development_governance_audit_read_only"
  },
  "enrollment_phase": "2A.2"
}
