{
  "schema_version": "1",
  "verification_id": "ve_20260911T214158248025Z_policy_manifest",
  "asset_id": "policy_manifest",
  "verified_at": "2026-09-11T21:41:58.249026+00:00",
  "verified_revision": "763f8c8e865130c165198696de4d2ab957d9ddfd",
  "verification_method": "phase2a2_baseline_enrollment",
  "resolved_watch_paths": [
    "ai_tool/policy/development_policy.json",
    "tests/ai_tool/policy/test_development_policy.py",
    "tests/ai_tool/policy/test_policy_distribution.py",
    "ai_tool/policy/loader.py",
    "ai_tool/policy/evaluate.py",
    "ai_tool/policy/enforce.py",
    "docs/DEVELOPMENT_TEST_POLICY.md"
  ],
  "watch_snapshots": [
    {
      "path": "ai_tool/policy/development_policy.json",
      "existence": true,
      "content_fingerprint": "sha256:34c9ac87159846d5a41afe87566e8e71c42542eaf3daad3408df043ce28b2e1d",
      "git_state_if_available": {
        "path": "ai_tool/policy/development_policy.json",
        "tracked": true,
        "porcelain": null
      }
    },
    {
      "path": "tests/ai_tool/policy/test_development_policy.py",
      "existence": true,
      "content_fingerprint": "sha256:cde3fd816eb87c9487f27792f7a9abcb7d20fc9c137504420eb7011e847f8182",
      "git_state_if_available": {
        "path": "tests/ai_tool/policy/test_development_policy.py",
        "tracked": true,
        "porcelain": null
      }
    },
    {
      "path": "tests/ai_tool/policy/test_policy_distribution.py",
      "existence": true,
      "content_fingerprint": "sha256:2ff8151deb751942073529f83e647cea1380e2f82685bbd234bc126aa04e6f6c",
      "git_state_if_available": {
        "path": "tests/ai_tool/policy/test_policy_distribution.py",
        "tracked": true,
        "porcelain": null
      }
    },
    {
      "path": "ai_tool/policy/loader.py",
      "existence": true,
      "content_fingerprint": "sha256:547a2fbf649e767c46a2dcca5de0eea05367872b8f0ed62a95b6ee2161964753",
      "git_state_if_available": {
        "path": "ai_tool/policy/loader.py",
        "tracked": true,
        "porcelain": null
      }
    },
    {
      "path": "ai_tool/policy/evaluate.py",
      "existence": true,
      "content_fingerprint": "sha256:b840b8189e026ff26203a757f132e7da2c7f939c5b6f157c8aad6f6dc6ded077",
      "git_state_if_available": {
        "path": "ai_tool/policy/evaluate.py",
        "tracked": true,
        "porcelain": null
      }
    },
    {
      "path": "ai_tool/policy/enforce.py",
      "existence": true,
      "content_fingerprint": "sha256:5c4875852ce146d5315fe070e8ee5bddbe7b7ae88bc495fdad7d72ac18950fce",
      "git_state_if_available": {
        "path": "ai_tool/policy/enforce.py",
        "tracked": true,
        "porcelain": null
      }
    },
    {
      "path": "docs/DEVELOPMENT_TEST_POLICY.md",
      "existence": true,
      "content_fingerprint": "sha256:6b4aca8f8744ce74e11284a0bc25b6c7005567632bf1064ef5a50358e532c417",
      "git_state_if_available": {
        "path": "docs/DEVELOPMENT_TEST_POLICY.md",
        "tracked": true,
        "porcelain": null
      }
    }
  ],
  "source_audit": {
    "verification_method": "cursor_development_governance_audit_read_only",
    "verified_at": "2026-09-11T21:19:00+09:00",
    "verified_revision": "763f8c8e865130c165198696de4d2ab957d9ddfd",
    "label": "cursor_development_governance_audit_read_only"
  },
  "enrollment_phase": "2A.2"
}
