{
  "schema_version": "1",
  "verification_id": "ve_20260911T214156845883Z_goal_completion_gate",
  "asset_id": "goal_completion_gate",
  "verified_at": "2026-09-11T21:41:56.846883+00:00",
  "verified_revision": "763f8c8e865130c165198696de4d2ab957d9ddfd",
  "verification_method": "phase2a2_baseline_enrollment",
  "resolved_watch_paths": [
    "docs/GOAL_COMPLETION_GATE_V0.md",
    "ai_tool/chat_interface/goal_completion_gate.py"
  ],
  "watch_snapshots": [
    {
      "path": "docs/GOAL_COMPLETION_GATE_V0.md",
      "existence": true,
      "content_fingerprint": "sha256:c96b1ccde3940440a37b764dc499424d758050b094c3c9aa3b1560eabb436080",
      "git_state_if_available": {
        "path": "docs/GOAL_COMPLETION_GATE_V0.md",
        "tracked": true,
        "porcelain": null
      }
    },
    {
      "path": "ai_tool/chat_interface/goal_completion_gate.py",
      "existence": true,
      "content_fingerprint": "sha256:815d7fcf417f49caf4f388fe992b0e0e53628ea142a9e08bdf027836d70feb65",
      "git_state_if_available": {
        "path": "ai_tool/chat_interface/goal_completion_gate.py",
        "tracked": true,
        "porcelain": null
      }
    }
  ],
  "source_audit": {
    "verification_method": "cursor_development_governance_audit_read_only",
    "verified_at": "2026-09-11T21:19:00+09:00",
    "verified_revision": "763f8c8e865130c165198696de4d2ab957d9ddfd",
    "label": "cursor_development_governance_audit_read_only"
  },
  "enrollment_phase": "2A.2"
}
